{"$schema":"https://json-schema.org/draft/2020-12/schema","type":"object","required":["schema_version","bundle_version","environment","run","log_tail","selectors","snapshots"],"properties":{"schema_version":{"const":"1.0.0"},"bundle_version":{"const":"1"},"environment":{"type":"object"},"run":{"type":"object"},"log_tail":{"type":"array","items":{"type":"string"}},"selectors":{"type":"object","required":["hits","misses","evidence"]},"snapshots":{"type":"array"}},"additionalProperties":false}
