{
  "bundle_version": "1",
  "environment": {
    "platform": "macOS-26.5.2-arm64-arm-64bit",
    "python": "3.12.10"
  },
  "log_tail": [
    "[REDACTED_PHONE]:19:58 [INFO] hhru_bot.throttle: Пауза 23.7с (между карточками резюме конкурентов)",
    "[REDACTED_PHONE]:20:24 [INFO] hhru_bot.throttle: Пауза 15.3с (между карточками резюме конкурентов)",
    "[REDACTED_PHONE]:20:43 [INFO] hhru_bot.throttle: Пауза 17.7с (между карточками резюме конкурентов)",
    "[REDACTED_PHONE]:21:03 [INFO] hhru_bot.throttle: Пауза 23.0с (между карточками резюме конкурентов)",
    "[REDACTED_PHONE]:21:29 [INFO] hhru_bot.throttle: Пауза 12.0с (между карточками резюме конкурентов)",
    "[REDACTED_PHONE]:21:44 [INFO] hhru_bot.throttle: Пауза 24.4с (между карточками резюме конкурентов)",
    "[REDACTED_PHONE]:22:11 [INFO] hhru_bot.throttle: Пауза 8.2с (между карточками резюме конкурентов)",
    "[REDACTED_PHONE]:22:23 [INFO] hhru_bot.throttle: Пауза 14.9с (между карточками резюме конкурентов)",
    "[REDACTED_PHONE]:22:40 [INFO] hhru_bot.throttle: Пауза 23.7с (между карточками резюме конкурентов)",
    "[REDACTED_PHONE]:23:07 [INFO] hhru_bot.throttle: Пауза 18.8с (между карточками резюме конкурентов)",
    "[REDACTED_PHONE]:23:33 [INFO] hhru_bot.throttle: Пауза 10.7с (между карточками резюме конкурентов)",
    "[REDACTED_PHONE]:23:57 [INFO] hhru_bot.throttle: Пауза 8.2с (между карточками резюме конкурентов)",
    "[REDACTED_PHONE]:24:08 [INFO] hhru_bot.throttle: Пауза 10.7с (между карточками резюме конкурентов)",
    "[REDACTED_PHONE]:24:20 [INFO] hhru_bot.throttle: Пауза 18.6с (между карточками резюме конкурентов)",
    "[REDACTED_PHONE]:24:41 [INFO] hhru_bot.throttle: Пауза 15.7с (между карточками резюме конкурентов)",
    "[REDACTED_PHONE]:25:00 [INFO] hhru_bot.throttle: Пауза 23.9с (между карточками резюме конкурентов)",
    "[REDACTED_PHONE]:25:27 [INFO] hhru_bot.throttle: Пауза 15.3с (между карточками резюме конкурентов)",
    "[REDACTED_PHONE]:25:46 [INFO] hhru_bot.throttle: Пауза 17.7с (между карточками резюме конкурентов)",
    "[REDACTED_PHONE]:26:07 [INFO] hhru_bot.throttle: Пауза 18.2с (между карточками резюме конкурентов)",
    "[REDACTED_PHONE]:26:27 [INFO] hhru_bot.throttle: Пауза 20.6с (между карточками резюме конкурентов)",
    "[REDACTED_PHONE]:26:50 [INFO] hhru_bot.throttle: Пауза 14.7с (между карточками резюме конкурентов)",
    "[REDACTED_PHONE]:27:07 [INFO] hhru_bot.throttle: Пауза 14.8с (между карточками резюме конкурентов)",
    "[REDACTED_PHONE]:27:25 [INFO] hhru_bot.throttle: Пауза 18.6с (между карточками резюме конкурентов)",
    "[REDACTED_PHONE]:27:46 [INFO] hhru_bot.throttle: Пауза 19.3с (между карточками резюме конкурентов)",
    "[REDACTED_PHONE]:28:08 [INFO] hhru_bot.throttle: Пауза 22.0с (между карточками резюме конкурентов)",
    "[REDACTED_PHONE]:28:32 [INFO] hhru_bot.throttle: Пауза 16.8с (между карточками резюме конкурентов)",
    "[REDACTED_PHONE]:28:52 [INFO] hhru_bot.throttle: Пауза 22.3с (между карточками резюме конкурентов)",
    "[REDACTED_PHONE]:29:16 [INFO] hhru_bot.throttle: Пауза 10.5с (между карточками резюме конкурентов)",
    "[REDACTED_PHONE]:29:30 [INFO] hhru_bot.throttle: Пауза 13.5с (между карточками резюме конкурентов)",
    "[REDACTED_PHONE]:29:51 [INFO] hhru_bot.throttle: Пауза 19.6с (между карточками резюме конкурентов)",
    "[REDACTED_PHONE]:30:12 [INFO] hhru_bot.throttle: Пауза 13.9с (между карточками резюме конкурентов)",
    "[REDACTED_PHONE]:30:29 [INFO] hhru_bot.throttle: Пауза 16.0с (между карточками резюме конкурентов)",
    "[REDACTED_PHONE]:30:50 [INFO] hhru_bot.throttle: Пауза 17.5с (между карточками резюме конкурентов)",
    "[REDACTED_PHONE]:31:11 [INFO] hhru_bot.throttle: Пауза 9.7с (между карточками резюме конкурентов)",
    "[REDACTED_PHONE]:31:23 [INFO] hhru_bot.throttle: Пауза 9.8с (между карточками резюме конкурентов)",
    "[REDACTED_PHONE]:31:36 [INFO] hhru_bot.throttle: Пауза 14.7с (между карточками резюме конкурентов)",
    "[REDACTED_PHONE]:31:53 [INFO] hhru_bot.throttle: Пауза 24.4с (между карточками резюме конкурентов)",
    "[REDACTED_PHONE]:32:20 [INFO] hhru_bot.throttle: Пауза 22.0с (между карточками резюме конкурентов)",
    "[REDACTED_PHONE]:32:46 [INFO] hhru_bot.throttle: Пауза 21.4с (между карточками резюме конкурентов)",
    "[REDACTED_PHONE]:33:11 [INFO] hhru_bot.throttle: Пауза 11.9с (между карточками резюме конкурентов)",
    "[REDACTED_PHONE]:33:26 [INFO] hhru_bot.throttle: Пауза 22.9с (между карточками резюме конкурентов)",
    "[REDACTED_PHONE]:33:51 [INFO] hhru_bot.throttle: Пауза 14.5с (между карточками резюме конкурентов)",
    "[REDACTED_PHONE]:34:08 [INFO] hhru_bot.throttle: Пауза 23.8с (между карточками резюме конкурентов)",
    "[REDACTED_PHONE]:34:36 [INFO] hhru_bot.throttle: Пауза 16.9с (между карточками резюме конкурентов)",
    "[REDACTED_PHONE]:34:54 [INFO] hhru_bot.throttle: Пауза 10.7с (между карточками резюме конкурентов)",
    "[REDACTED_PHONE]:35:07 [INFO] hhru_bot.throttle: Пауза 22.7с (между карточками резюме конкурентов)",
    "[REDACTED_PHONE]:35:31 [INFO] hhru_bot.throttle: Пауза 10.0с (между карточками резюме конкурентов)",
    "[REDACTED_PHONE]:35:43 [INFO] hhru_bot.throttle: Пауза 20.6с (между карточками резюме конкурентов)",
    "[REDACTED_PHONE]:36:05 [INFO] hhru_bot.throttle: Пауза 12.0с (между карточками резюме конкурентов)",
    "[REDACTED_PHONE]:36:23 [INFO] hhru_bot.throttle: Пауза 12.0с (между карточками резюме конкурентов)",
    "[REDACTED_PHONE]:36:36 [INFO] hhru_bot.throttle: Пауза 21.4с (между карточками резюме конкурентов)",
    "[REDACTED_PHONE]:36:59 [INFO] hhru_bot.throttle: Пауза 8.3с (между карточками резюме конкурентов)",
    "[REDACTED_PHONE]:37:09 [INFO] hhru_bot.throttle: Пауза 13.7с (между карточками резюме конкурентов)",
    "[REDACTED_PHONE]:37:25 [INFO] hhru_bot.throttle: Пауза 13.0с (между карточками резюме конкурентов)",
    "[REDACTED_PHONE]:37:40 [INFO] hhru_bot.throttle: Пауза 22.5с (между карточками резюме конкурентов)",
    "[REDACTED_PHONE]:38:04 [INFO] hhru_bot.throttle: Пауза 18.7с (между карточками резюме конкурентов)",
    "[REDACTED_PHONE]:38:25 [INFO] hhru_bot.throttle: Пауза 18.5с (между карточками резюме конкурентов)",
    "[REDACTED_PHONE]:38:45 [INFO] hhru_bot.throttle: Пауза 9.1с (между карточками резюме конкурентов)",
    "[REDACTED_PHONE]:38:56 [INFO] hhru_bot.throttle: Пауза 13.3с (между карточками резюме конкурентов)",
    "[REDACTED_PHONE]:39:12 [INFO] hhru_bot.throttle: Пауза 20.4с (между карточками резюме конкурентов)",
    "[REDACTED_PHONE]:39:34 [INFO] hhru_bot.throttle: Пауза 24.3с (между карточками резюме конкурентов)",
    "[REDACTED_PHONE]:40:00 [INFO] hhru_bot.throttle: Пауза 12.6с (между карточками резюме конкурентов)",
    "[REDACTED_PHONE]:40:14 [INFO] hhru_bot.throttle: Пауза 20.2с (между карточками резюме конкурентов)",
    "[REDACTED_PHONE]:40:36 [INFO] hhru_bot.throttle: Пауза 24.8с (между карточками резюме конкурентов)",
    "[REDACTED_PHONE]:41:03 [INFO] hhru_bot.throttle: Пауза 19.1с (между карточками резюме конкурентов)",
    "[REDACTED_PHONE]:41:24 [INFO] hhru_bot.throttle: Пауза 20.3с (между карточками резюме конкурентов)",
    "[REDACTED_PHONE]:41:46 [INFO] hhru_bot.throttle: Пауза 21.8с (между карточками резюме конкурентов)",
    "[REDACTED_PHONE]:42:09 [INFO] hhru_bot.throttle: Пауза 15.2с (между карточками резюме конкурентов)",
    "[REDACTED_PHONE]:42:27 [INFO] hhru_bot.throttle: Пауза 18.8с (между карточками резюме конкурентов)",
    "[REDACTED_PHONE]:42:50 [INFO] hhru_bot.throttle: Пауза 14.8с (между карточками резюме конкурентов)",
    "[REDACTED_PHONE]:43:08 [INFO] hhru_bot.throttle: Пауза 20.1с (между карточками резюме конкурентов)",
    "[REDACTED_PHONE]:43:30 [INFO] hhru_bot.throttle: Пауза 24.8с (между карточками резюме конкурентов)",
    "[REDACTED_PHONE]:14:25 [INFO] hhru_bot.browser: Загружена сохранённая сессия: /Users/axisrow/Projects/hhru/data/storage_state/hh_session.json",
    "[REDACTED_PHONE]:16:40 [INFO] hhru_bot.browser: Загружена сохранённая сессия: /Users/axisrow/Projects/hhru/data/storage_state/hh_session.json",
    "[REDACTED_PHONE]:42:12 [INFO] hhru_bot.browser: Загружена сохранённая сессия: /Users/axisrow/Projects/hhru/data/storage_state/hh_session.json",
    "[REDACTED_PHONE]:42:12 [INFO] hhru_bot.search: Загрузка страницы поиска: https://hh.ru/search/vacancy?text=%D0%9C%D0%B0%D1%80%D0%BA%D0%B5%D1%82%D0%BE%D0%BB%D0%BE%D0%B3&page=0&area=113&schedule=remote",
    "[REDACTED_PHONE]:42:17 [INFO] hhru_bot.search: Найдено вакансий всего: 20",
    "[REDACTED_PHONE]:48:13 [INFO] hhru_bot.browser: Загружена сохранённая сессия: /Users/axisrow/Projects/hhru/data/storage_state/hh_session.json",
    "[REDACTED_PHONE]:48:30 [INFO] hhru_bot.browser: Загружена сохранённая сессия: /Users/axisrow/Projects/hhru/data/storage_state/hh_session.json",
    "[REDACTED_PHONE]:49:36 [INFO] hhru_bot.browser: Загружена сохранённая сессия: /Users/axisrow/Projects/hhru/data/storage_state/hh_session.json"
  ],
  "run": {
    "attempted": 0,
    "command": "edit_education",
    "detail": null,
    "exit_code": 1,
    "failed": 0,
    "finished_at": "2026-08-25T21:49:57.177891",
    "owner_pid": 78449,
    "requested_limit": 1,
    "run_id": "ca1be663-f7fb-4d54-b811-74c14a149e75",
    "skipped": 0,
    "started_at": "2026-08-25T21:49:36.268117",
    "status": "failed",
    "success": 0,
    "uncertain": 0
  },
  "schema_version": "1.0.0",
  "selectors": {
    "evidence": [],
    "hits": [],
    "misses": []
  },
  "snapshots": [
    {
      "available": true,
      "nodes": [
        {
          "tag": "html"
        },
        {
          "tag": "head"
        },
        {
          "tag": "script"
        },
        {
          "tag": "meta"
        },
        {
          "tag": "meta"
        },
        {
          "tag": "meta"
        },
        {
          "tag": "meta"
        },
        {
          "tag": "meta"
        },
        {
          "tag": "script"
        },
        {
          "tag": "script"
        },
        {